[
  {
    "event_id": "accept_exam_nomination",
    "title": "余澄当众接下春闱之命",
    "summary": "余澄在花厅当众应下应试，表面顺从，实则将自己推进更深的命运轨道。",
    "location": "花厅",
    "actors": [
      "yu_cheng",
      "lady_rong"
    ],
    "scene_function": "false_peace",
    "tags": [
      "duty",
      "ambition",
      "reputation"
    ],
    "preconditions_all": [
      "spring_exam_announced",
      "yu_cheng_nominated"
    ],
    "forbidden_if_any": [
      "yu_refused_exam_publicly"
    ],
    "world_fact_deltas_add": [
      "yu_cheng_commits_exam"
    ],
    "world_fact_deltas_remove": [],
    "belief_updates": {},
    "trust_deltas": [],
    "emotion_deltas": [
      {
        "character": "yu_cheng",
        "emotion": "anxiety",
        "delta": 0.08
      },
      {
        "character": "lady_rong",
        "emotion": "worry",
        "delta": -0.05
      }
    ],
    "promises_open": [
      {
        "promise_id": "must_sit_first_exam",
        "description": "余澄既已应下春闱，就必须在后续面对真正入场或公开反悔的代价。",
        "opened_at_turn": 0,
        "due_by_turn": 3,
        "holders": [
          "yu_cheng",
          "lady_rong"
        ],
        "fulfillment_modes": [
          "sit_the_exam",
          "refuse_the_exam_publicly"
        ],
        "status": "open",
        "stakes": "family_reputation_and_selfhood",
        "tags": [
          "exam",
          "duty",
          "public_commitment"
        ]
      }
    ],
    "promises_close": [],
    "tension_delta": 0.1,
    "theme_impacts": {
      "duty": 0.08,
      "reputation": 0.06
    },
    "agency_affordances": [
      "ambition",
      "loyalty",
      "duty"
    ],
    "rating_ceiling": "PG",
    "convergence_key": "",
    "metadata": {},
    "temptation_vector": {
      "pride": 0.16,
      "doubt": 0.08,
      "delusion": 0.14
    },
    "vow_tests": [
      "keep_house_intact"
    ],
    "wound_triggers": [
      "永远要证明自己才值得被留下"
    ],
    "debt_deltas": [
      {
        "source": "yu_cheng",
        "target": "lady_rong",
        "debt_type": "obedience",
        "magnitude": 0.34,
        "obligation": 0.12,
        "shame": 0.08,
        "note": "当众接命，欠下门楣一笔顺从债"
      }
    ],
    "karmic_seed_creations": [
      {
        "seed_id": "seed_accept_exam_face",
        "source_event_id": "accept_exam_nomination",
        "actor": "yu_cheng",
        "target": "lady_rong",
        "seed_type": "suppressed_self",
        "charge": 0.58,
        "tags": [
          "duty",
          "reputation",
          "concealment"
        ],
        "created_at_turn": 0,
        "ripening_conditions": [
          "truth_trial",
          "karma_ripening",
          "public_crisis"
        ],
        "earliest_turn": 2,
        "latest_turn": 8,
        "status": "dormant",
        "transformable_by": [
          "full_confession",
          "vow_payment"
        ]
      }
    ],
    "karmic_seed_resolutions": [],
    "awakening_affordances": [],
    "concealment_level": 0.72,
    "consequence_delay_hint": 2
  },
  {
    "event_id": "secret_meet_lin_wan",
    "title": "余澄夜访林绾试探真心",
    "summary": "余澄在回廊暗处与林绾相见，试图探口风，也暴露了自己的犹豫与软弱。",
    "location": "回廊",
    "actors": [
      "yu_cheng",
      "lin_wan"
    ],
    "scene_function": "temptation",
    "tags": [
      "love",
      "secrecy",
      "curiosity",
      "selfhood"
    ],
    "preconditions_all": [
      "spring_exam_announced"
    ],
    "forbidden_if_any": [],
    "world_fact_deltas_add": [
      "yu_cheng_secretly_met_lin_wan"
    ],
    "world_fact_deltas_remove": [],
    "belief_updates": {},
    "trust_deltas": [
      {
        "source": "lin_wan",
        "target": "yu_cheng",
        "delta": 0.03
      }
    ],
    "emotion_deltas": [
      {
        "character": "lin_wan",
        "emotion": "doubt",
        "delta": 0.05
      }
    ],
    "promises_open": [
      {
        "promise_id": "truth_between_yu_and_lin",
        "description": "余澄与林绾之间必须就真实意图有一次不可回避的坦白或决裂。",
        "opened_at_turn": 0,
        "due_by_turn": 3,
        "holders": [
          "yu_cheng",
          "lin_wan"
        ],
        "fulfillment_modes": [
          "lin_wan_asks_for_truth",
          "leave_manor_with_lin",
          "win_honors_but_lose_lin"
        ],
        "status": "open",
        "stakes": "love_and_trust",
        "tags": [
          "romance",
          "honesty",
          "secrecy"
        ]
      }
    ],
    "promises_close": [],
    "tension_delta": 0.08,
    "theme_impacts": {
      "love": 0.1,
      "selfhood": 0.05
    },
    "agency_affordances": [
      "romance",
      "curiosity",
      "selfhood",
      "secrecy"
    ],
    "rating_ceiling": "PG",
    "convergence_key": "",
    "metadata": {},
    "temptation_vector": {
      "greed": 0.12,
      "doubt": 0.16,
      "delusion": 0.18
    },
    "vow_tests": [
      "tell_lin_wan_the_whole_truth"
    ],
    "wound_triggers": [
      "先相信的人总是先受伤",
      "永远要证明自己才值得被留下"
    ],
    "debt_deltas": [
      {
        "source": "yu_cheng",
        "target": "lin_wan",
        "debt_type": "half_truth",
        "magnitude": 0.41,
        "attachment": 0.08,
        "projection": 0.1,
        "fear": 0.08,
        "note": "试探真心却仍说了半句假话"
      }
    ],
    "karmic_seed_creations": [
      {
        "seed_id": "seed_half_truth_lin",
        "source_event_id": "secret_meet_lin_wan",
        "actor": "yu_cheng",
        "target": "lin_wan",
        "seed_type": "concealed_truth",
        "charge": 0.72,
        "tags": [
          "love",
          "secrecy",
          "doubt"
        ],
        "created_at_turn": 0,
        "ripening_conditions": [
          "truth_trial",
          "karma_ripening",
          "third_party_reveal"
        ],
        "earliest_turn": 2,
        "latest_turn": 9,
        "status": "dormant",
        "transformable_by": [
          "full_confession",
          "mutual_truth",
          "sacrifice"
        ]
      }
    ],
    "karmic_seed_resolutions": [],
    "awakening_affordances": [],
    "concealment_level": 0.84,
    "consequence_delay_hint": 3
  },
  {
    "event_id": "confide_in_tutor_xu",
    "title": "余澄向徐师吐露对科举的怀疑",
    "summary": "余澄在书房向徐师吐露心事，请他给出不损家门又不违本心的路。",
    "location": "书房",
    "actors": [
      "yu_cheng",
      "tutor_xu"
    ],
    "scene_function": "confession_window",
    "tags": [
      "honesty",
      "mentorship",
      "duty",
      "selfhood"
    ],
    "preconditions_all": [
      "spring_exam_announced",
      "tutor_xu_observes_yu_cheng"
    ],
    "forbidden_if_any": [],
    "world_fact_deltas_add": [
      "tutor_knows_yu_doubts"
    ],
    "world_fact_deltas_remove": [],
    "belief_updates": {
      "tutor_xu": {
        "add_true": [
          "yu_cheng_doubts_exam"
        ],
        "add_false": []
      }
    },
    "trust_deltas": [
      {
        "source": "tutor_xu",
        "target": "yu_cheng",
        "delta": 0.08
      }
    ],
    "emotion_deltas": [
      {
        "character": "yu_cheng",
        "emotion": "anxiety",
        "delta": -0.06
      }
    ],
    "promises_open": [],
    "promises_close": [],
    "tension_delta": 0.04,
    "theme_impacts": {
      "selfhood": 0.07,
      "duty": 0.04
    },
    "agency_affordances": [
      "honesty",
      "selfhood",
      "discipline"
    ],
    "rating_ceiling": "PG",
    "convergence_key": "",
    "metadata": {},
    "temptation_vector": {
      "doubt": 0.06,
      "delusion": -0.04,
      "pride": 0.02
    },
    "vow_tests": [
      "speak_plainly_once"
    ],
    "wound_triggers": [
      "永远要证明自己才值得被留下"
    ],
    "debt_deltas": [
      {
        "source": "yu_cheng",
        "target": "tutor_xu",
        "debt_type": "gratitude",
        "magnitude": 0.18,
        "gratitude": 0.12,
        "obligation": 0.06,
        "note": "把心事托给徐师，也欠下一份愿被看见的情"
      }
    ],
    "karmic_seed_creations": [
      {
        "seed_id": "seed_confession_xu",
        "source_event_id": "confide_in_tutor_xu",
        "actor": "yu_cheng",
        "target": "tutor_xu",
        "seed_type": "mercy",
        "charge": 0.32,
        "tags": [
          "truth",
          "mentorship",
          "mercy"
        ],
        "created_at_turn": 0,
        "ripening_conditions": [
          "truth_trial",
          "public_witness"
        ],
        "earliest_turn": 2,
        "latest_turn": 8,
        "status": "dormant",
        "transformable_by": [
          "truth_testimony",
          "public_witness"
        ]
      }
    ],
    "karmic_seed_resolutions": [],
    "awakening_affordances": [
      "admit_fear"
    ],
    "concealment_level": 0.34,
    "consequence_delay_hint": 2
  },
  {
    "event_id": "lin_wan_asks_for_truth",
    "title": "林绾逼问余澄：你到底是为谁去考",
    "summary": "林绾不再接受含混试探，逼问余澄究竟是为名声、为家门，还是为自己。",
    "location": "花园",
    "actors": [
      "lin_wan",
      "yu_cheng"
    ],
    "scene_function": "truth_trial",
    "tags": [
      "honesty",
      "love",
      "duty",
      "selfhood"
    ],
    "preconditions_all": [
      "yu_cheng_secretly_met_lin_wan"
    ],
    "forbidden_if_any": [],
    "world_fact_deltas_add": [
      "lin_wan_demands_truth"
    ],
    "world_fact_deltas_remove": [],
    "belief_updates": {},
    "trust_deltas": [
      {
        "source": "lin_wan",
        "target": "yu_cheng",
        "delta": -0.05
      }
    ],
    "emotion_deltas": [
      {
        "character": "yu_cheng",
        "emotion": "defiance",
        "delta": 0.06
      },
      {
        "character": "lin_wan",
        "emotion": "concern",
        "delta": 0.05
      }
    ],
    "promises_open": [
      {
        "promise_id": "choose_love_or_exam",
        "description": "余澄必须在爱情、家门与自我之间作出至少一次不可逆选择。",
        "opened_at_turn": 1,
        "due_by_turn": 4,
        "holders": [
          "yu_cheng",
          "lin_wan"
        ],
        "fulfillment_modes": [
          "leave_manor_with_lin",
          "sit_the_exam",
          "refuse_the_exam_publicly"
        ],
        "status": "open",
        "stakes": "love_duty_selfhood",